{"$schema":"http://json-schema.org/draft-07/schema#","title":"review.v1","type":"object","additionalProperties":false,"required":["schema","work_id","attempt","content_digest","role","verdict","blocking_findings","notes","reviewer","reviewed_at"],"properties":{"schema":{"const":"review.v1"},"work_id":{"type":"string","pattern":"^[0-9a-f]{64}$"},"attempt":{"type":"integer","minimum":1},"content_digest":{"type":"string","pattern":"^[0-9a-f]{64}$"},"role":{"enum":["correctness","value","falsification"]},"verdict":{"enum":["approve","revise","reject"]},"blocking_findings":{"type":"array","items":{"type":"object","additionalProperties":false,"required":["claim_ref","finding","evidence_pointer"],"properties":{"claim_ref":{"type":"string"},"finding":{"type":"string"},"evidence_pointer":{"type":"string"}}}},"notes":{"type":"string"},"reviewer":{"type":"object","additionalProperties":false,"required":["carrier","flight_ref"],"properties":{"carrier":{"type":"string"},"flight_ref":{"type":"string"}}},"reviewed_at":{"type":"string","pattern":"^\\d{4}-\\d{2}-\\d{2}T[^ ]+Z$","format":"date-time"}}}
