{"schema":"review.v1","work_id":"aaaaaaaaaaaaaaaaaaaaaaaaaaaaaaaaaaaaaaaaaaaaaaaaaaaaaaaaaaaaaaaa","attempt":1,"content_digest":"bbbbbbbbbbbbbbbbbbbbbbbbbbbbbbbbbbbbbbbbbbbbbbbbbbbbbbbbbbbbbbbb","role":"correctness","verdict":"approve","blocking_findings":[],"notes":"ok","reviewer":{"carrier":"x","flight_ref":"f"},"reviewed_at":"2026-01-01T00:00:00Z"}
